{"schema_version":"0.1","session_id":"5c6534aa12241915b5f489356b96f7db","remote_ip":null,"first_seen":"2026-06-20T01:37:25Z","last_seen":"2026-06-20T01:37:27Z","request_count":22,"signals":{"network":[{"schema_version":"0.1","session_id":"5c6534aa12241915b5f489356b96f7db","layer":"network","kind":"ch_platform_header","value":"Linux","source":"edge","observed_at":"2026-06-20T01:37:27Z"},{"schema_version":"0.1","session_id":"5c6534aa12241915b5f489356b96f7db","layer":"network","kind":"ch_ua_browser","value":"chrome","source":"edge","observed_at":"2026-06-20T01:37:27Z"},{"schema_version":"0.1","session_id":"5c6534aa12241915b5f489356b96f7db","layer":"network","kind":"h2","value":"1:65536;2:0;4:6291456;6:262144|15663105|0|m,a,s,p","source":"edge","observed_at":"2026-06-20T01:37:27Z"},{"schema_version":"0.1","session_id":"5c6534aa12241915b5f489356b96f7db","layer":"network","kind":"h2_browser_hint","value":"chrome","source":"edge","observed_at":"2026-06-20T01:37:27Z"},{"schema_version":"0.1","session_id":"5c6534aa12241915b5f489356b96f7db","layer":"network","kind":"h2_settings_hint","value":"chrome","source":"edge","observed_at":"2026-06-20T01:37:27Z"},{"schema_version":"0.1","session_id":"5c6534aa12241915b5f489356b96f7db","layer":"network","kind":"ja3","value":"212b288438dd11ad67dd94bb8cdce703","source":"edge","observed_at":"2026-06-20T01:37:27Z"},{"schema_version":"0.1","session_id":"5c6534aa12241915b5f489356b96f7db","layer":"network","kind":"ja4","value":"t13d1516h2_8daaf6152771_d8a2da3f94cd","source":"edge","observed_at":"2026-06-20T01:37:27Z"},{"schema_version":"0.1","session_id":"5c6534aa12241915b5f489356b96f7db","layer":"network","kind":"ja4_browser_hint","value":"chrome","source":"edge","observed_at":"2026-06-20T01:37:27Z"},{"schema_version":"0.1","session_id":"5c6534aa12241915b5f489356b96f7db","layer":"network","kind":"observed_ip","value":"172.22.0.5","source":"edge","observed_at":"2026-06-20T01:37:27Z"},{"schema_version":"0.1","session_id":"5c6534aa12241915b5f489356b96f7db","layer":"network","kind":"tcp_kernel","value":"linux","source":"edge","observed_at":"2026-06-20T01:37:27Z"},{"schema_version":"0.1","session_id":"5c6534aa12241915b5f489356b96f7db","layer":"network","kind":"ua_kernel","value":"linux","source":"edge","observed_at":"2026-06-20T01:37:27Z"}],"browser":[{"schema_version":"0.1","session_id":"5c6534aa12241915b5f489356b96f7db","layer":"browser","kind":"cdp_runtime_enabled","value":true,"source":"collector","observed_at":"2026-06-20T01:37:26.813000Z"},{"schema_version":"0.1","session_id":"5c6534aa12241915b5f489356b96f7db","layer":"browser","kind":"ch_he_headless","value":true,"source":"collector","observed_at":"2026-06-20T01:37:26.813000Z"},{"schema_version":"0.1","session_id":"5c6534aa12241915b5f489356b96f7db","layer":"browser","kind":"ch_platform","value":"Linux","source":"collector","observed_at":"2026-06-20T01:37:26.813000Z"},{"schema_version":"0.1","session_id":"5c6534aa12241915b5f489356b96f7db","layer":"browser","kind":"chrome_no_pdfviewer","value":true,"source":"collector","observed_at":"2026-06-20T01:37:26.813000Z"},{"schema_version":"0.1","session_id":"5c6534aa12241915b5f489356b96f7db","layer":"browser","kind":"chrome_object_missing","value":true,"source":"collector","observed_at":"2026-06-20T01:37:26.813000Z"},{"schema_version":"0.1","session_id":"5c6534aa12241915b5f489356b96f7db","layer":"browser","kind":"color_depth","value":24,"source":"collector","observed_at":"2026-06-20T01:37:26.813000Z"},{"schema_version":"0.1","session_id":"5c6534aa12241915b5f489356b96f7db","layer":"browser","kind":"font_os_hint","value":"Linux","source":"collector","observed_at":"2026-06-20T01:37:26.813000Z"},{"schema_version":"0.1","session_id":"5c6534aa12241915b5f489356b96f7db","layer":"browser","kind":"fp_hash","value":"bf779223","source":"collector","observed_at":"2026-06-20T01:37:26.813000Z"},{"schema_version":"0.1","session_id":"5c6534aa12241915b5f489356b96f7db","layer":"browser","kind":"hardware_concurrency","value":12,"source":"collector","observed_at":"2026-06-20T01:37:26.813000Z"},{"schema_version":"0.1","session_id":"5c6534aa12241915b5f489356b96f7db","layer":"browser","kind":"media_devices_empty","value":true,"source":"collector","observed_at":"2026-06-20T01:37:26.813000Z"},{"schema_version":"0.1","session_id":"5c6534aa12241915b5f489356b96f7db","layer":"browser","kind":"mimetypes_empty","value":true,"source":"collector","observed_at":"2026-06-20T01:37:26.813000Z"},{"schema_version":"0.1","session_id":"5c6534aa12241915b5f489356b96f7db","layer":"browser","kind":"nav_language_primary","value":"en","source":"collector","observed_at":"2026-06-20T01:37:26.813000Z"},{"schema_version":"0.1","session_id":"5c6534aa12241915b5f489356b96f7db","layer":"browser","kind":"nav_platform_os","value":"Linux","source":"collector","observed_at":"2026-06-20T01:37:26.813000Z"},{"schema_version":"0.1","session_id":"5c6534aa12241915b5f489356b96f7db","layer":"browser","kind":"notification_denied","value":true,"source":"collector","observed_at":"2026-06-20T01:37:26.813000Z"},{"schema_version":"0.1","session_id":"5c6534aa12241915b5f489356b96f7db","layer":"browser","kind":"permissions_anomaly","value":true,"source":"collector","observed_at":"2026-06-20T01:37:26.813000Z"},{"schema_version":"0.1","session_id":"5c6534aa12241915b5f489356b96f7db","layer":"browser","kind":"plugins_count","value":0,"source":"collector","observed_at":"2026-06-20T01:37:26.813000Z"},{"schema_version":"0.1","session_id":"5c6534aa12241915b5f489356b96f7db","layer":"browser","kind":"productsub_render","value":"webkit","source":"collector","observed_at":"2026-06-20T01:37:26.813000Z"},{"schema_version":"0.1","session_id":"5c6534aa12241915b5f489356b96f7db","layer":"browser","kind":"screen_resolution","value":"1280x720","source":"collector","observed_at":"2026-06-20T01:37:26.813000Z"},{"schema_version":"0.1","session_id":"5c6534aa12241915b5f489356b96f7db","layer":"browser","kind":"ua_browser","value":"chrome","source":"collector","observed_at":"2026-06-20T01:37:26.813000Z"},{"schema_version":"0.1","session_id":"5c6534aa12241915b5f489356b96f7db","layer":"browser","kind":"ua_engine","value":"chromium","source":"collector","observed_at":"2026-06-20T01:37:26.813000Z"},{"schema_version":"0.1","session_id":"5c6534aa12241915b5f489356b96f7db","layer":"browser","kind":"ua_is_headless","value":true,"source":"collector","observed_at":"2026-06-20T01:37:26.813000Z"},{"schema_version":"0.1","session_id":"5c6534aa12241915b5f489356b96f7db","layer":"browser","kind":"ua_platform","value":"Linux","source":"collector","observed_at":"2026-06-20T01:37:26.813000Z"},{"schema_version":"0.1","session_id":"5c6534aa12241915b5f489356b96f7db","layer":"browser","kind":"ua_render","value":"webkit","source":"collector","observed_at":"2026-06-20T01:37:26.813000Z"},{"schema_version":"0.1","session_id":"5c6534aa12241915b5f489356b96f7db","layer":"browser","kind":"vendor_engine","value":"chromium","source":"collector","observed_at":"2026-06-20T01:37:26.813000Z"},{"schema_version":"0.1","session_id":"5c6534aa12241915b5f489356b96f7db","layer":"browser","kind":"voices_empty","value":true,"source":"collector","observed_at":"2026-06-20T01:37:26.813000Z"},{"schema_version":"0.1","session_id":"5c6534aa12241915b5f489356b96f7db","layer":"browser","kind":"webdriver","value":false,"source":"collector","observed_at":"2026-06-20T01:37:26.813000Z"},{"schema_version":"0.1","session_id":"5c6534aa12241915b5f489356b96f7db","layer":"browser","kind":"webdriver_spoofed","value":true,"source":"collector","observed_at":"2026-06-20T01:37:26.813000Z"},{"schema_version":"0.1","session_id":"5c6534aa12241915b5f489356b96f7db","layer":"browser","kind":"webgl_renderer","value":"ANGLE (Google, Vulkan 1.3.0 (SwiftShader Device (Subzero) (0x0000C0DE)), SwiftShader driver)","source":"collector","observed_at":"2026-06-20T01:37:26.813000Z"},{"schema_version":"0.1","session_id":"5c6534aa12241915b5f489356b96f7db","layer":"browser","kind":"webgl_software","value":true,"source":"collector","observed_at":"2026-06-20T01:37:26.813000Z"},{"schema_version":"0.1","session_id":"5c6534aa12241915b5f489356b96f7db","layer":"browser","kind":"webgl_vendor","value":"Google Inc. (Google)","source":"collector","observed_at":"2026-06-20T01:37:26.813000Z"},{"schema_version":"0.1","session_id":"5c6534aa12241915b5f489356b96f7db","layer":"browser","kind":"webgpu_no_adapter","value":true,"source":"collector","observed_at":"2026-06-20T01:37:26.813000Z"}],"behavioral":[{"schema_version":"0.1","session_id":"5c6534aa12241915b5f489356b96f7db","layer":"behavioral","kind":"mouse_entropy","value":0.6276186878973496,"source":"collector","observed_at":"2026-06-20T01:37:26.813000Z"},{"schema_version":"0.1","session_id":"5c6534aa12241915b5f489356b96f7db","layer":"behavioral","kind":"mouse_straightness","value":0.31505297394049175,"source":"collector","observed_at":"2026-06-20T01:37:26.813000Z"},{"schema_version":"0.1","session_id":"5c6534aa12241915b5f489356b96f7db","layer":"behavioral","kind":"mouse_velocity_cv","value":1,"source":"collector","observed_at":"2026-06-20T01:37:26.813000Z"},{"schema_version":"0.1","session_id":"5c6534aa12241915b5f489356b96f7db","layer":"behavioral","kind":"pause_ratio","value":0,"source":"collector","observed_at":"2026-06-20T01:37:26.813000Z"},{"schema_version":"0.1","session_id":"5c6534aa12241915b5f489356b96f7db","layer":"behavioral","kind":"pointer_event_count","value":17,"source":"collector","observed_at":"2026-06-20T01:37:26.813000Z"},{"schema_version":"0.1","session_id":"5c6534aa12241915b5f489356b96f7db","layer":"behavioral","kind":"submovement_count","value":0,"source":"collector","observed_at":"2026-06-20T01:37:26.813000Z"},{"schema_version":"0.1","session_id":"5c6534aa12241915b5f489356b96f7db","layer":"behavioral","kind":"trace_hash","value":"e1a50028","source":"collector","observed_at":"2026-06-20T01:37:26.813000Z"}],"reputation":[]}}