{"schema_version":"0.1","session_id":"40ecc6b682463d9a5eca17a7abdad18c","remote_ip":null,"first_seen":"2026-06-19T02:32:35Z","last_seen":"2026-06-19T02:32:37Z","request_count":20,"signals":{"network":[{"schema_version":"0.1","session_id":"40ecc6b682463d9a5eca17a7abdad18c","layer":"network","kind":"ch_platform_header","value":"Linux","source":"edge","observed_at":"2026-06-19T02:32:37Z"},{"schema_version":"0.1","session_id":"40ecc6b682463d9a5eca17a7abdad18c","layer":"network","kind":"ch_ua_browser","value":"chrome","source":"edge","observed_at":"2026-06-19T02:32:37Z"},{"schema_version":"0.1","session_id":"40ecc6b682463d9a5eca17a7abdad18c","layer":"network","kind":"h2","value":"1:65536;2:0;4:6291456;6:262144|15663105|0|m,a,s,p","source":"edge","observed_at":"2026-06-19T02:32:37Z"},{"schema_version":"0.1","session_id":"40ecc6b682463d9a5eca17a7abdad18c","layer":"network","kind":"h2_browser_hint","value":"chrome","source":"edge","observed_at":"2026-06-19T02:32:37Z"},{"schema_version":"0.1","session_id":"40ecc6b682463d9a5eca17a7abdad18c","layer":"network","kind":"h2_settings_hint","value":"chrome","source":"edge","observed_at":"2026-06-19T02:32:37Z"},{"schema_version":"0.1","session_id":"40ecc6b682463d9a5eca17a7abdad18c","layer":"network","kind":"ja3","value":"896f5794096a93fb43dd048b9cef17a9","source":"edge","observed_at":"2026-06-19T02:32:37Z"},{"schema_version":"0.1","session_id":"40ecc6b682463d9a5eca17a7abdad18c","layer":"network","kind":"ja4","value":"t13d1516h2_8daaf6152771_d8a2da3f94cd","source":"edge","observed_at":"2026-06-19T02:32:37Z"},{"schema_version":"0.1","session_id":"40ecc6b682463d9a5eca17a7abdad18c","layer":"network","kind":"observed_ip","value":"172.22.0.5","source":"edge","observed_at":"2026-06-19T02:32:37Z"},{"schema_version":"0.1","session_id":"40ecc6b682463d9a5eca17a7abdad18c","layer":"network","kind":"tcp_kernel","value":"linux","source":"edge","observed_at":"2026-06-19T02:32:37Z"},{"schema_version":"0.1","session_id":"40ecc6b682463d9a5eca17a7abdad18c","layer":"network","kind":"ua_kernel","value":"linux","source":"edge","observed_at":"2026-06-19T02:32:37Z"}],"browser":[{"schema_version":"0.1","session_id":"40ecc6b682463d9a5eca17a7abdad18c","layer":"browser","kind":"cdp_runtime_enabled","value":true,"source":"collector","observed_at":"2026-06-19T02:32:36.668000Z"},{"schema_version":"0.1","session_id":"40ecc6b682463d9a5eca17a7abdad18c","layer":"browser","kind":"ch_he_headless","value":true,"source":"collector","observed_at":"2026-06-19T02:32:36.668000Z"},{"schema_version":"0.1","session_id":"40ecc6b682463d9a5eca17a7abdad18c","layer":"browser","kind":"ch_platform","value":"Linux","source":"collector","observed_at":"2026-06-19T02:32:36.668000Z"},{"schema_version":"0.1","session_id":"40ecc6b682463d9a5eca17a7abdad18c","layer":"browser","kind":"chrome_no_pdfviewer","value":true,"source":"collector","observed_at":"2026-06-19T02:32:36.668000Z"},{"schema_version":"0.1","session_id":"40ecc6b682463d9a5eca17a7abdad18c","layer":"browser","kind":"chrome_object_missing","value":true,"source":"collector","observed_at":"2026-06-19T02:32:36.668000Z"},{"schema_version":"0.1","session_id":"40ecc6b682463d9a5eca17a7abdad18c","layer":"browser","kind":"color_depth","value":24,"source":"collector","observed_at":"2026-06-19T02:32:36.668000Z"},{"schema_version":"0.1","session_id":"40ecc6b682463d9a5eca17a7abdad18c","layer":"browser","kind":"fp_hash","value":"91784558","source":"collector","observed_at":"2026-06-19T02:32:36.668000Z"},{"schema_version":"0.1","session_id":"40ecc6b682463d9a5eca17a7abdad18c","layer":"browser","kind":"hardware_concurrency","value":12,"source":"collector","observed_at":"2026-06-19T02:32:36.668000Z"},{"schema_version":"0.1","session_id":"40ecc6b682463d9a5eca17a7abdad18c","layer":"browser","kind":"math_engine_mismatch","value":true,"source":"collector","observed_at":"2026-06-19T02:32:36.668000Z"},{"schema_version":"0.1","session_id":"40ecc6b682463d9a5eca17a7abdad18c","layer":"browser","kind":"media_devices_empty","value":true,"source":"collector","observed_at":"2026-06-19T02:32:36.668000Z"},{"schema_version":"0.1","session_id":"40ecc6b682463d9a5eca17a7abdad18c","layer":"browser","kind":"mimetypes_empty","value":true,"source":"collector","observed_at":"2026-06-19T02:32:36.668000Z"},{"schema_version":"0.1","session_id":"40ecc6b682463d9a5eca17a7abdad18c","layer":"browser","kind":"native_invariant_violated","value":true,"source":"collector","observed_at":"2026-06-19T02:32:36.668000Z"},{"schema_version":"0.1","session_id":"40ecc6b682463d9a5eca17a7abdad18c","layer":"browser","kind":"nav_language_primary","value":"en","source":"collector","observed_at":"2026-06-19T02:32:36.668000Z"},{"schema_version":"0.1","session_id":"40ecc6b682463d9a5eca17a7abdad18c","layer":"browser","kind":"nav_platform_os","value":"Linux","source":"collector","observed_at":"2026-06-19T02:32:36.668000Z"},{"schema_version":"0.1","session_id":"40ecc6b682463d9a5eca17a7abdad18c","layer":"browser","kind":"notification_denied","value":true,"source":"collector","observed_at":"2026-06-19T02:32:36.668000Z"},{"schema_version":"0.1","session_id":"40ecc6b682463d9a5eca17a7abdad18c","layer":"browser","kind":"permissions_anomaly","value":true,"source":"collector","observed_at":"2026-06-19T02:32:36.668000Z"},{"schema_version":"0.1","session_id":"40ecc6b682463d9a5eca17a7abdad18c","layer":"browser","kind":"plugins_count","value":0,"source":"collector","observed_at":"2026-06-19T02:32:36.668000Z"},{"schema_version":"0.1","session_id":"40ecc6b682463d9a5eca17a7abdad18c","layer":"browser","kind":"productsub_render","value":"webkit","source":"collector","observed_at":"2026-06-19T02:32:36.668000Z"},{"schema_version":"0.1","session_id":"40ecc6b682463d9a5eca17a7abdad18c","layer":"browser","kind":"screen_resolution","value":"1280x720","source":"collector","observed_at":"2026-06-19T02:32:36.668000Z"},{"schema_version":"0.1","session_id":"40ecc6b682463d9a5eca17a7abdad18c","layer":"browser","kind":"ua_browser","value":"chrome","source":"collector","observed_at":"2026-06-19T02:32:36.668000Z"},{"schema_version":"0.1","session_id":"40ecc6b682463d9a5eca17a7abdad18c","layer":"browser","kind":"ua_engine","value":"chromium","source":"collector","observed_at":"2026-06-19T02:32:36.668000Z"},{"schema_version":"0.1","session_id":"40ecc6b682463d9a5eca17a7abdad18c","layer":"browser","kind":"ua_is_headless","value":true,"source":"collector","observed_at":"2026-06-19T02:32:36.668000Z"},{"schema_version":"0.1","session_id":"40ecc6b682463d9a5eca17a7abdad18c","layer":"browser","kind":"ua_platform","value":"Linux","source":"collector","observed_at":"2026-06-19T02:32:36.668000Z"},{"schema_version":"0.1","session_id":"40ecc6b682463d9a5eca17a7abdad18c","layer":"browser","kind":"ua_render","value":"webkit","source":"collector","observed_at":"2026-06-19T02:32:36.668000Z"},{"schema_version":"0.1","session_id":"40ecc6b682463d9a5eca17a7abdad18c","layer":"browser","kind":"vendor_engine","value":"chromium","source":"collector","observed_at":"2026-06-19T02:32:36.668000Z"},{"schema_version":"0.1","session_id":"40ecc6b682463d9a5eca17a7abdad18c","layer":"browser","kind":"voices_empty","value":true,"source":"collector","observed_at":"2026-06-19T02:32:36.668000Z"},{"schema_version":"0.1","session_id":"40ecc6b682463d9a5eca17a7abdad18c","layer":"browser","kind":"webdriver","value":false,"source":"collector","observed_at":"2026-06-19T02:32:36.668000Z"},{"schema_version":"0.1","session_id":"40ecc6b682463d9a5eca17a7abdad18c","layer":"browser","kind":"webdriver_getter_tampered","value":true,"source":"collector","observed_at":"2026-06-19T02:32:36.668000Z"},{"schema_version":"0.1","session_id":"40ecc6b682463d9a5eca17a7abdad18c","layer":"browser","kind":"webgl_os_hint","value":"Windows","source":"collector","observed_at":"2026-06-19T02:32:36.668000Z"},{"schema_version":"0.1","session_id":"40ecc6b682463d9a5eca17a7abdad18c","layer":"browser","kind":"webgl_renderer","value":"ANGLE (NVIDIA, NVIDIA GeForce RTX 3060 Direct3D11 vs_5_0 ps_5_0, D3D11)","source":"collector","observed_at":"2026-06-19T02:32:36.668000Z"},{"schema_version":"0.1","session_id":"40ecc6b682463d9a5eca17a7abdad18c","layer":"browser","kind":"webgl_vendor","value":"Google Inc. (Google)","source":"collector","observed_at":"2026-06-19T02:32:36.668000Z"},{"schema_version":"0.1","session_id":"40ecc6b682463d9a5eca17a7abdad18c","layer":"browser","kind":"webgl_worker_divergence","value":true,"source":"collector","observed_at":"2026-06-19T02:32:36.668000Z"},{"schema_version":"0.1","session_id":"40ecc6b682463d9a5eca17a7abdad18c","layer":"browser","kind":"webgpu_no_adapter","value":true,"source":"collector","observed_at":"2026-06-19T02:32:36.668000Z"},{"schema_version":"0.1","session_id":"40ecc6b682463d9a5eca17a7abdad18c","layer":"browser","kind":"webgpu_webgl_mismatch","value":true,"source":"collector","observed_at":"2026-06-19T02:32:36.668000Z"}],"behavioral":[{"schema_version":"0.1","session_id":"40ecc6b682463d9a5eca17a7abdad18c","layer":"behavioral","kind":"keystroke_entropy","value":0,"source":"collector","observed_at":"2026-06-19T02:32:36.668000Z"},{"schema_version":"0.1","session_id":"40ecc6b682463d9a5eca17a7abdad18c","layer":"behavioral","kind":"mouse_entropy","value":0.5618250990757782,"source":"collector","observed_at":"2026-06-19T02:32:36.668000Z"},{"schema_version":"0.1","session_id":"40ecc6b682463d9a5eca17a7abdad18c","layer":"behavioral","kind":"mouse_straightness","value":0.4990864492814254,"source":"collector","observed_at":"2026-06-19T02:32:36.668000Z"},{"schema_version":"0.1","session_id":"40ecc6b682463d9a5eca17a7abdad18c","layer":"behavioral","kind":"mouse_velocity_cv","value":1.4714736276813731,"source":"collector","observed_at":"2026-06-19T02:32:36.668000Z"},{"schema_version":"0.1","session_id":"40ecc6b682463d9a5eca17a7abdad18c","layer":"behavioral","kind":"pointer_event_count","value":11,"source":"collector","observed_at":"2026-06-19T02:32:36.668000Z"}],"reputation":[]}}