{
 "schema_version": "0.1",
 "session_id": "c2dcc0639395db530113bd911ab52e54",
 "remote_ip": null,
 "first_seen": "2026-06-20T06:57:30Z",
 "last_seen": "2026-06-20T06:57:32.287000Z",
 "request_count": 26,
 "signals": {
  "network": [
   {
    "schema_version": "0.1",
    "session_id": "c2dcc0639395db530113bd911ab52e54",
    "layer": "network",
    "kind": "accept_language_primary",
    "value": "en",
    "source": "edge",
    "observed_at": "2026-06-20T06:57:32Z"
   },
   {
    "schema_version": "0.1",
    "session_id": "c2dcc0639395db530113bd911ab52e54",
    "layer": "network",
    "kind": "h2",
    "value": "1:65536;2:0;4:6291456;6:262144;47706:1062214200|15663105|0|m,a,s,p",
    "source": "edge",
    "observed_at": "2026-06-20T06:57:32Z"
   },
   {
    "schema_version": "0.1",
    "session_id": "c2dcc0639395db530113bd911ab52e54",
    "layer": "network",
    "kind": "h2_browser_hint",
    "value": "chrome",
    "source": "edge",
    "observed_at": "2026-06-20T06:57:32Z"
   },
   {
    "schema_version": "0.1",
    "session_id": "c2dcc0639395db530113bd911ab52e54",
    "layer": "network",
    "kind": "h2_header_order_non_chromium",
    "value": true,
    "source": "edge",
    "observed_at": "2026-06-20T06:57:32Z"
   },
   {
    "schema_version": "0.1",
    "session_id": "c2dcc0639395db530113bd911ab52e54",
    "layer": "network",
    "kind": "h2_settings_hint",
    "value": "chrome",
    "source": "edge",
    "observed_at": "2026-06-20T06:57:32Z"
   },
   {
    "schema_version": "0.1",
    "session_id": "c2dcc0639395db530113bd911ab52e54",
    "layer": "network",
    "kind": "ja3",
    "value": "35939b74b5a4d5c17f4f44dd88ed9f71",
    "source": "edge",
    "observed_at": "2026-06-20T06:57:32Z"
   },
   {
    "schema_version": "0.1",
    "session_id": "c2dcc0639395db530113bd911ab52e54",
    "layer": "network",
    "kind": "ja4",
    "value": "t13d1516h2_8daaf6152771_d8a2da3f94cd",
    "source": "edge",
    "observed_at": "2026-06-20T06:57:32Z"
   },
   {
    "schema_version": "0.1",
    "session_id": "c2dcc0639395db530113bd911ab52e54",
    "layer": "network",
    "kind": "ja4_browser_hint",
    "value": "chrome",
    "source": "edge",
    "observed_at": "2026-06-20T06:57:32Z"
   },
   {
    "schema_version": "0.1",
    "session_id": "c2dcc0639395db530113bd911ab52e54",
    "layer": "network",
    "kind": "observed_ip",
    "value": "172.22.0.4",
    "source": "edge",
    "observed_at": "2026-06-20T06:57:32Z"
   },
   {
    "schema_version": "0.1",
    "session_id": "c2dcc0639395db530113bd911ab52e54",
    "layer": "network",
    "kind": "quic_no_grease",
    "value": true,
    "source": "edge",
    "observed_at": "2026-06-20T06:57:32Z"
   },
   {
    "schema_version": "0.1",
    "session_id": "c2dcc0639395db530113bd911ab52e54",
    "layer": "network",
    "kind": "quic_observed",
    "value": true,
    "source": "edge",
    "observed_at": "2026-06-20T06:57:32Z"
   },
   {
    "schema_version": "0.1",
    "session_id": "c2dcc0639395db530113bd911ab52e54",
    "layer": "network",
    "kind": "tcp_kernel",
    "value": "linux",
    "source": "edge",
    "observed_at": "2026-06-20T06:57:32Z"
   },
   {
    "schema_version": "0.1",
    "session_id": "c2dcc0639395db530113bd911ab52e54",
    "layer": "network",
    "kind": "ua_kernel",
    "value": "linux",
    "source": "edge",
    "observed_at": "2026-06-20T06:57:32Z"
   }
  ],
  "browser": [
   {
    "schema_version": "0.1",
    "session_id": "c2dcc0639395db530113bd911ab52e54",
    "layer": "browser",
    "kind": "chrome_runtime_missing",
    "value": true,
    "source": "collector",
    "observed_at": "2026-06-20T06:57:32.287000Z"
   },
   {
    "schema_version": "0.1",
    "session_id": "c2dcc0639395db530113bd911ab52e54",
    "layer": "browser",
    "kind": "color_depth",
    "value": 24,
    "source": "collector",
    "observed_at": "2026-06-20T06:57:32.287000Z"
   },
   {
    "schema_version": "0.1",
    "session_id": "c2dcc0639395db530113bd911ab52e54",
    "layer": "browser",
    "kind": "fp_hash",
    "value": "afb0f922",
    "source": "collector",
    "observed_at": "2026-06-20T06:57:32.287000Z"
   },
   {
    "schema_version": "0.1",
    "session_id": "c2dcc0639395db530113bd911ab52e54",
    "layer": "browser",
    "kind": "hardware_concurrency",
    "value": 12,
    "source": "collector",
    "observed_at": "2026-06-20T06:57:32.287000Z"
   },
   {
    "schema_version": "0.1",
    "session_id": "c2dcc0639395db530113bd911ab52e54",
    "layer": "browser",
    "kind": "hover_none_desktop",
    "value": true,
    "source": "collector",
    "observed_at": "2026-06-20T06:57:32.287000Z"
   },
   {
    "schema_version": "0.1",
    "session_id": "c2dcc0639395db530113bd911ab52e54",
    "layer": "browser",
    "kind": "media_devices_empty",
    "value": true,
    "source": "collector",
    "observed_at": "2026-06-20T06:57:32.287000Z"
   },
   {
    "schema_version": "0.1",
    "session_id": "c2dcc0639395db530113bd911ab52e54",
    "layer": "browser",
    "kind": "nav_language_primary",
    "value": "en",
    "source": "collector",
    "observed_at": "2026-06-20T06:57:32.287000Z"
   },
   {
    "schema_version": "0.1",
    "session_id": "c2dcc0639395db530113bd911ab52e54",
    "layer": "browser",
    "kind": "nav_platform_os",
    "value": "Linux",
    "source": "collector",
    "observed_at": "2026-06-20T06:57:32.287000Z"
   },
   {
    "schema_version": "0.1",
    "session_id": "c2dcc0639395db530113bd911ab52e54",
    "layer": "browser",
    "kind": "plugins_count",
    "value": 5,
    "source": "collector",
    "observed_at": "2026-06-20T06:57:32.287000Z"
   },
   {
    "schema_version": "0.1",
    "session_id": "c2dcc0639395db530113bd911ab52e54",
    "layer": "browser",
    "kind": "productsub_render",
    "value": "webkit",
    "source": "collector",
    "observed_at": "2026-06-20T06:57:32.287000Z"
   },
   {
    "schema_version": "0.1",
    "session_id": "c2dcc0639395db530113bd911ab52e54",
    "layer": "browser",
    "kind": "screen_resolution",
    "value": "800x600",
    "source": "collector",
    "observed_at": "2026-06-20T06:57:32.287000Z"
   },
   {
    "schema_version": "0.1",
    "session_id": "c2dcc0639395db530113bd911ab52e54",
    "layer": "browser",
    "kind": "ua_browser",
    "value": "chrome",
    "source": "collector",
    "observed_at": "2026-06-20T06:57:32.287000Z"
   },
   {
    "schema_version": "0.1",
    "session_id": "c2dcc0639395db530113bd911ab52e54",
    "layer": "browser",
    "kind": "ua_engine",
    "value": "chromium",
    "source": "collector",
    "observed_at": "2026-06-20T06:57:32.287000Z"
   },
   {
    "schema_version": "0.1",
    "session_id": "c2dcc0639395db530113bd911ab52e54",
    "layer": "browser",
    "kind": "ua_platform",
    "value": "Linux",
    "source": "collector",
    "observed_at": "2026-06-20T06:57:32.287000Z"
   },
   {
    "schema_version": "0.1",
    "session_id": "c2dcc0639395db530113bd911ab52e54",
    "layer": "browser",
    "kind": "ua_render",
    "value": "webkit",
    "source": "collector",
    "observed_at": "2026-06-20T06:57:32.287000Z"
   },
   {
    "schema_version": "0.1",
    "session_id": "c2dcc0639395db530113bd911ab52e54",
    "layer": "browser",
    "kind": "vendor_engine",
    "value": "chromium",
    "source": "collector",
    "observed_at": "2026-06-20T06:57:32.287000Z"
   },
   {
    "schema_version": "0.1",
    "session_id": "c2dcc0639395db530113bd911ab52e54",
    "layer": "browser",
    "kind": "voices_empty",
    "value": true,
    "source": "collector",
    "observed_at": "2026-06-20T06:57:32.287000Z"
   },
   {
    "schema_version": "0.1",
    "session_id": "c2dcc0639395db530113bd911ab52e54",
    "layer": "browser",
    "kind": "webdriver",
    "value": false,
    "source": "collector",
    "observed_at": "2026-06-20T06:57:32.287000Z"
   },
   {
    "schema_version": "0.1",
    "session_id": "c2dcc0639395db530113bd911ab52e54",
    "layer": "browser",
    "kind": "webgl_renderer",
    "value": "ANGLE (Google, Vulkan 1.3.0 (SwiftShader Device (Subzero) (0x0000C0DE)), SwiftShader driver)",
    "source": "collector",
    "observed_at": "2026-06-20T06:57:32.287000Z"
   },
   {
    "schema_version": "0.1",
    "session_id": "c2dcc0639395db530113bd911ab52e54",
    "layer": "browser",
    "kind": "webgl_software",
    "value": true,
    "source": "collector",
    "observed_at": "2026-06-20T06:57:32.287000Z"
   },
   {
    "schema_version": "0.1",
    "session_id": "c2dcc0639395db530113bd911ab52e54",
    "layer": "browser",
    "kind": "webgl_vendor",
    "value": "Google Inc. (Google)",
    "source": "collector",
    "observed_at": "2026-06-20T06:57:32.287000Z"
   },
   {
    "schema_version": "0.1",
    "session_id": "c2dcc0639395db530113bd911ab52e54",
    "layer": "browser",
    "kind": "webgpu_no_adapter",
    "value": true,
    "source": "collector",
    "observed_at": "2026-06-20T06:57:32.287000Z"
   },
   {
    "schema_version": "0.1",
    "session_id": "c2dcc0639395db530113bd911ab52e54",
    "layer": "browser",
    "kind": "webrtc_unavailable",
    "value": true,
    "source": "collector",
    "observed_at": "2026-06-20T06:57:32.287000Z"
   }
  ],
  "behavioral": [
   {
    "schema_version": "0.1",
    "session_id": "c2dcc0639395db530113bd911ab52e54",
    "layer": "behavioral",
    "kind": "mouse_entropy",
    "value": 0,
    "source": "collector",
    "observed_at": "2026-06-20T06:57:32.287000Z"
   },
   {
    "schema_version": "0.1",
    "session_id": "c2dcc0639395db530113bd911ab52e54",
    "layer": "behavioral",
    "kind": "pointer_event_count",
    "value": 0,
    "source": "collector",
    "observed_at": "2026-06-20T06:57:32.287000Z"
   }
  ],
  "reputation": []
 }
}
