{"schema_version":"0.1","session_id":"2ed643adf1594c7d7c5b8462df712645","remote_ip":null,"first_seen":"2026-06-20T10:07:51Z","last_seen":"2026-06-20T10:07:53Z","request_count":22,"signals":{"network":[{"schema_version":"0.1","session_id":"2ed643adf1594c7d7c5b8462df712645","layer":"network","kind":"accept_language_primary","value":"en","source":"edge","observed_at":"2026-06-20T10:07:53Z"},{"schema_version":"0.1","session_id":"2ed643adf1594c7d7c5b8462df712645","layer":"network","kind":"h2","value":"1:65536;2:0;4:131072;5:16384|12517377|0|m,p,a,s","source":"edge","observed_at":"2026-06-20T10:07:53Z"},{"schema_version":"0.1","session_id":"2ed643adf1594c7d7c5b8462df712645","layer":"network","kind":"h2_browser_hint","value":"firefox","source":"edge","observed_at":"2026-06-20T10:07:53Z"},{"schema_version":"0.1","session_id":"2ed643adf1594c7d7c5b8462df712645","layer":"network","kind":"h2_settings_hint","value":"firefox","source":"edge","observed_at":"2026-06-20T10:07:53Z"},{"schema_version":"0.1","session_id":"2ed643adf1594c7d7c5b8462df712645","layer":"network","kind":"ja3","value":"d87a30a5782a73a83c1544bb06332780","source":"edge","observed_at":"2026-06-20T10:07:53Z"},{"schema_version":"0.1","session_id":"2ed643adf1594c7d7c5b8462df712645","layer":"network","kind":"ja4","value":"t13d1717h2_5b57614c22b0_3cbfd9057e0d","source":"edge","observed_at":"2026-06-20T10:07:53Z"},{"schema_version":"0.1","session_id":"2ed643adf1594c7d7c5b8462df712645","layer":"network","kind":"ja4_browser_hint","value":"firefox","source":"edge","observed_at":"2026-06-20T10:07:53Z"},{"schema_version":"0.1","session_id":"2ed643adf1594c7d7c5b8462df712645","layer":"network","kind":"observed_ip","value":"172.22.0.5","source":"edge","observed_at":"2026-06-20T10:07:53Z"},{"schema_version":"0.1","session_id":"2ed643adf1594c7d7c5b8462df712645","layer":"network","kind":"quic_observed","value":true,"source":"edge","observed_at":"2026-06-20T10:07:53Z"},{"schema_version":"0.1","session_id":"2ed643adf1594c7d7c5b8462df712645","layer":"network","kind":"tcp_kernel","value":"linux","source":"edge","observed_at":"2026-06-20T10:07:53Z"},{"schema_version":"0.1","session_id":"2ed643adf1594c7d7c5b8462df712645","layer":"network","kind":"ua_kernel","value":"linux","source":"edge","observed_at":"2026-06-20T10:07:53Z"},{"schema_version":"0.1","session_id":"2ed643adf1594c7d7c5b8462df712645","layer":"network","kind":"observed_ip_seen","value":["172.22.0.5"],"source":"edge","observed_at":"2026-06-20T10:07:51Z"}],"browser":[{"schema_version":"0.1","session_id":"2ed643adf1594c7d7c5b8462df712645","layer":"browser","kind":"color_depth","value":24,"source":"collector","observed_at":"2026-06-20T10:07:52.995000Z"},{"schema_version":"0.1","session_id":"2ed643adf1594c7d7c5b8462df712645","layer":"browser","kind":"fp_hash","value":"2d80f2a6","source":"collector","observed_at":"2026-06-20T10:07:52.995000Z"},{"schema_version":"0.1","session_id":"2ed643adf1594c7d7c5b8462df712645","layer":"browser","kind":"hardware_concurrency","value":16,"source":"collector","observed_at":"2026-06-20T10:07:52.995000Z"},{"schema_version":"0.1","session_id":"2ed643adf1594c7d7c5b8462df712645","layer":"browser","kind":"media_devices_empty","value":true,"source":"collector","observed_at":"2026-06-20T10:07:52.995000Z"},{"schema_version":"0.1","session_id":"2ed643adf1594c7d7c5b8462df712645","layer":"browser","kind":"nav_language_primary","value":"en","source":"collector","observed_at":"2026-06-20T10:07:52.995000Z"},{"schema_version":"0.1","session_id":"2ed643adf1594c7d7c5b8462df712645","layer":"browser","kind":"nav_platform_os","value":"Linux","source":"collector","observed_at":"2026-06-20T10:07:52.995000Z"},{"schema_version":"0.1","session_id":"2ed643adf1594c7d7c5b8462df712645","layer":"browser","kind":"oscpu_os","value":"Linux","source":"collector","observed_at":"2026-06-20T10:07:52.995000Z"},{"schema_version":"0.1","session_id":"2ed643adf1594c7d7c5b8462df712645","layer":"browser","kind":"plugins_count","value":5,"source":"collector","observed_at":"2026-06-20T10:07:52.995000Z"},{"schema_version":"0.1","session_id":"2ed643adf1594c7d7c5b8462df712645","layer":"browser","kind":"productsub_render","value":"gecko","source":"collector","observed_at":"2026-06-20T10:07:52.995000Z"},{"schema_version":"0.1","session_id":"2ed643adf1594c7d7c5b8462df712645","layer":"browser","kind":"screen_resolution","value":"1707x960","source":"collector","observed_at":"2026-06-20T10:07:52.995000Z"},{"schema_version":"0.1","session_id":"2ed643adf1594c7d7c5b8462df712645","layer":"browser","kind":"ua_browser","value":"firefox","source":"collector","observed_at":"2026-06-20T10:07:52.995000Z"},{"schema_version":"0.1","session_id":"2ed643adf1594c7d7c5b8462df712645","layer":"browser","kind":"ua_engine","value":"firefox","source":"collector","observed_at":"2026-06-20T10:07:52.995000Z"},{"schema_version":"0.1","session_id":"2ed643adf1594c7d7c5b8462df712645","layer":"browser","kind":"ua_platform","value":"Linux","source":"collector","observed_at":"2026-06-20T10:07:52.995000Z"},{"schema_version":"0.1","session_id":"2ed643adf1594c7d7c5b8462df712645","layer":"browser","kind":"ua_render","value":"gecko","source":"collector","observed_at":"2026-06-20T10:07:52.995000Z"},{"schema_version":"0.1","session_id":"2ed643adf1594c7d7c5b8462df712645","layer":"browser","kind":"vendor_engine","value":"firefox","source":"collector","observed_at":"2026-06-20T10:07:52.995000Z"},{"schema_version":"0.1","session_id":"2ed643adf1594c7d7c5b8462df712645","layer":"browser","kind":"voices_empty","value":true,"source":"collector","observed_at":"2026-06-20T10:07:52.995000Z"},{"schema_version":"0.1","session_id":"2ed643adf1594c7d7c5b8462df712645","layer":"browser","kind":"webdriver","value":false,"source":"collector","observed_at":"2026-06-20T10:07:52.995000Z"},{"schema_version":"0.1","session_id":"2ed643adf1594c7d7c5b8462df712645","layer":"browser","kind":"webgl2_missing","value":true,"source":"collector","observed_at":"2026-06-20T10:07:52.995000Z"},{"schema_version":"0.1","session_id":"2ed643adf1594c7d7c5b8462df712645","layer":"browser","kind":"webgpu_absent","value":true,"source":"collector","observed_at":"2026-06-20T10:07:52.995000Z"},{"schema_version":"0.1","session_id":"2ed643adf1594c7d7c5b8462df712645","layer":"browser","kind":"webrtc_public_ip","value":"172.22.0.6","source":"collector","observed_at":"2026-06-20T10:07:52.995000Z"}],"behavioral":[{"schema_version":"0.1","session_id":"2ed643adf1594c7d7c5b8462df712645","layer":"behavioral","kind":"coalesced_events_absent","value":true,"source":"collector","observed_at":"2026-06-20T10:07:52.995000Z"},{"schema_version":"0.1","session_id":"2ed643adf1594c7d7c5b8462df712645","layer":"behavioral","kind":"mouse_entropy","value":0.8879858703789033,"source":"collector","observed_at":"2026-06-20T10:07:52.995000Z"},{"schema_version":"0.1","session_id":"2ed643adf1594c7d7c5b8462df712645","layer":"behavioral","kind":"mouse_straightness","value":0.22778217476102197,"source":"collector","observed_at":"2026-06-20T10:07:52.995000Z"},{"schema_version":"0.1","session_id":"2ed643adf1594c7d7c5b8462df712645","layer":"behavioral","kind":"mouse_velocity_cv","value":0.8173678802041052,"source":"collector","observed_at":"2026-06-20T10:07:52.995000Z"},{"schema_version":"0.1","session_id":"2ed643adf1594c7d7c5b8462df712645","layer":"behavioral","kind":"pause_ratio","value":0.08695652173913043,"source":"collector","observed_at":"2026-06-20T10:07:52.995000Z"},{"schema_version":"0.1","session_id":"2ed643adf1594c7d7c5b8462df712645","layer":"behavioral","kind":"pointer_event_count","value":24,"source":"collector","observed_at":"2026-06-20T10:07:52.995000Z"},{"schema_version":"0.1","session_id":"2ed643adf1594c7d7c5b8462df712645","layer":"behavioral","kind":"power_law_exponent","value":0.23052950304789308,"source":"collector","observed_at":"2026-06-20T10:07:52.995000Z"},{"schema_version":"0.1","session_id":"2ed643adf1594c7d7c5b8462df712645","layer":"behavioral","kind":"submovement_count","value":9,"source":"collector","observed_at":"2026-06-20T10:07:52.995000Z"},{"schema_version":"0.1","session_id":"2ed643adf1594c7d7c5b8462df712645","layer":"behavioral","kind":"trace_hash","value":"4747d6e6","source":"collector","observed_at":"2026-06-20T10:07:52.995000Z"}],"reputation":[]}}
