{"schema_version":"0.1","session_id":"90ed717574e0ef908489c4f77937461d","remote_ip":null,"first_seen":"2026-06-20T10:30:51Z","last_seen":"2026-06-20T10:30:54Z","request_count":22,"signals":{"network":[{"schema_version":"0.1","session_id":"90ed717574e0ef908489c4f77937461d","layer":"network","kind":"accept_language_primary","value":"en","source":"edge","observed_at":"2026-06-20T10:30:54Z"},{"schema_version":"0.1","session_id":"90ed717574e0ef908489c4f77937461d","layer":"network","kind":"h2","value":"1:65536;2:0;4:131072;5:16384|12517377|0|m,p,a,s","source":"edge","observed_at":"2026-06-20T10:30:54Z"},{"schema_version":"0.1","session_id":"90ed717574e0ef908489c4f77937461d","layer":"network","kind":"h2_browser_hint","value":"firefox","source":"edge","observed_at":"2026-06-20T10:30:54Z"},{"schema_version":"0.1","session_id":"90ed717574e0ef908489c4f77937461d","layer":"network","kind":"h2_settings_hint","value":"firefox","source":"edge","observed_at":"2026-06-20T10:30:54Z"},{"schema_version":"0.1","session_id":"90ed717574e0ef908489c4f77937461d","layer":"network","kind":"ja3","value":"d87a30a5782a73a83c1544bb06332780","source":"edge","observed_at":"2026-06-20T10:30:54Z"},{"schema_version":"0.1","session_id":"90ed717574e0ef908489c4f77937461d","layer":"network","kind":"ja4","value":"t13d1717h2_5b57614c22b0_3cbfd9057e0d","source":"edge","observed_at":"2026-06-20T10:30:54Z"},{"schema_version":"0.1","session_id":"90ed717574e0ef908489c4f77937461d","layer":"network","kind":"ja4_browser_hint","value":"firefox","source":"edge","observed_at":"2026-06-20T10:30:54Z"},{"schema_version":"0.1","session_id":"90ed717574e0ef908489c4f77937461d","layer":"network","kind":"observed_ip","value":"172.22.0.5","source":"edge","observed_at":"2026-06-20T10:30:54Z"},{"schema_version":"0.1","session_id":"90ed717574e0ef908489c4f77937461d","layer":"network","kind":"quic_observed","value":true,"source":"edge","observed_at":"2026-06-20T10:30:54Z"},{"schema_version":"0.1","session_id":"90ed717574e0ef908489c4f77937461d","layer":"network","kind":"tcp_kernel","value":"linux","source":"edge","observed_at":"2026-06-20T10:30:54Z"},{"schema_version":"0.1","session_id":"90ed717574e0ef908489c4f77937461d","layer":"network","kind":"ua_kernel","value":"linux","source":"edge","observed_at":"2026-06-20T10:30:54Z"},{"schema_version":"0.1","session_id":"90ed717574e0ef908489c4f77937461d","layer":"network","kind":"observed_ip_seen","value":["172.22.0.5"],"source":"edge","observed_at":"2026-06-20T10:30:51Z"}],"browser":[{"schema_version":"0.1","session_id":"90ed717574e0ef908489c4f77937461d","layer":"browser","kind":"color_depth","value":24,"source":"collector","observed_at":"2026-06-20T10:30:53.572000Z"},{"schema_version":"0.1","session_id":"90ed717574e0ef908489c4f77937461d","layer":"browser","kind":"fp_hash","value":"ed54dfec","source":"collector","observed_at":"2026-06-20T10:30:53.572000Z"},{"schema_version":"0.1","session_id":"90ed717574e0ef908489c4f77937461d","layer":"browser","kind":"hardware_concurrency","value":4,"source":"collector","observed_at":"2026-06-20T10:30:53.572000Z"},{"schema_version":"0.1","session_id":"90ed717574e0ef908489c4f77937461d","layer":"browser","kind":"media_devices_empty","value":true,"source":"collector","observed_at":"2026-06-20T10:30:53.572000Z"},{"schema_version":"0.1","session_id":"90ed717574e0ef908489c4f77937461d","layer":"browser","kind":"nav_language_primary","value":"en","source":"collector","observed_at":"2026-06-20T10:30:53.572000Z"},{"schema_version":"0.1","session_id":"90ed717574e0ef908489c4f77937461d","layer":"browser","kind":"nav_platform_os","value":"Linux","source":"collector","observed_at":"2026-06-20T10:30:53.572000Z"},{"schema_version":"0.1","session_id":"90ed717574e0ef908489c4f77937461d","layer":"browser","kind":"oscpu_os","value":"Linux","source":"collector","observed_at":"2026-06-20T10:30:53.572000Z"},{"schema_version":"0.1","session_id":"90ed717574e0ef908489c4f77937461d","layer":"browser","kind":"plugins_count","value":5,"source":"collector","observed_at":"2026-06-20T10:30:53.572000Z"},{"schema_version":"0.1","session_id":"90ed717574e0ef908489c4f77937461d","layer":"browser","kind":"productsub_render","value":"gecko","source":"collector","observed_at":"2026-06-20T10:30:53.572000Z"},{"schema_version":"0.1","session_id":"90ed717574e0ef908489c4f77937461d","layer":"browser","kind":"screen_resolution","value":"2624x1476","source":"collector","observed_at":"2026-06-20T10:30:53.572000Z"},{"schema_version":"0.1","session_id":"90ed717574e0ef908489c4f77937461d","layer":"browser","kind":"ua_browser","value":"firefox","source":"collector","observed_at":"2026-06-20T10:30:53.572000Z"},{"schema_version":"0.1","session_id":"90ed717574e0ef908489c4f77937461d","layer":"browser","kind":"ua_engine","value":"firefox","source":"collector","observed_at":"2026-06-20T10:30:53.572000Z"},{"schema_version":"0.1","session_id":"90ed717574e0ef908489c4f77937461d","layer":"browser","kind":"ua_platform","value":"Linux","source":"collector","observed_at":"2026-06-20T10:30:53.572000Z"},{"schema_version":"0.1","session_id":"90ed717574e0ef908489c4f77937461d","layer":"browser","kind":"ua_render","value":"gecko","source":"collector","observed_at":"2026-06-20T10:30:53.572000Z"},{"schema_version":"0.1","session_id":"90ed717574e0ef908489c4f77937461d","layer":"browser","kind":"vendor_engine","value":"firefox","source":"collector","observed_at":"2026-06-20T10:30:53.572000Z"},{"schema_version":"0.1","session_id":"90ed717574e0ef908489c4f77937461d","layer":"browser","kind":"voices_empty","value":true,"source":"collector","observed_at":"2026-06-20T10:30:53.572000Z"},{"schema_version":"0.1","session_id":"90ed717574e0ef908489c4f77937461d","layer":"browser","kind":"webdriver","value":false,"source":"collector","observed_at":"2026-06-20T10:30:53.572000Z"},{"schema_version":"0.1","session_id":"90ed717574e0ef908489c4f77937461d","layer":"browser","kind":"webgl2_missing","value":true,"source":"collector","observed_at":"2026-06-20T10:30:53.572000Z"},{"schema_version":"0.1","session_id":"90ed717574e0ef908489c4f77937461d","layer":"browser","kind":"webgpu_absent","value":true,"source":"collector","observed_at":"2026-06-20T10:30:53.572000Z"},{"schema_version":"0.1","session_id":"90ed717574e0ef908489c4f77937461d","layer":"browser","kind":"webrtc_public_ip","value":"52.0.0.1","source":"collector","observed_at":"2026-06-20T10:30:53.572000Z"}],"behavioral":[{"schema_version":"0.1","session_id":"90ed717574e0ef908489c4f77937461d","layer":"behavioral","kind":"coalesced_events_absent","value":true,"source":"collector","observed_at":"2026-06-20T10:30:53.572000Z"},{"schema_version":"0.1","session_id":"90ed717574e0ef908489c4f77937461d","layer":"behavioral","kind":"mouse_entropy","value":0.8790992319428571,"source":"collector","observed_at":"2026-06-20T10:30:53.572000Z"},{"schema_version":"0.1","session_id":"90ed717574e0ef908489c4f77937461d","layer":"behavioral","kind":"mouse_straightness","value":0.28145672476927797,"source":"collector","observed_at":"2026-06-20T10:30:53.572000Z"},{"schema_version":"0.1","session_id":"90ed717574e0ef908489c4f77937461d","layer":"behavioral","kind":"mouse_velocity_cv","value":0.5915555369691959,"source":"collector","observed_at":"2026-06-20T10:30:53.572000Z"},{"schema_version":"0.1","session_id":"90ed717574e0ef908489c4f77937461d","layer":"behavioral","kind":"pause_ratio","value":0,"source":"collector","observed_at":"2026-06-20T10:30:53.572000Z"},{"schema_version":"0.1","session_id":"90ed717574e0ef908489c4f77937461d","layer":"behavioral","kind":"pointer_event_count","value":24,"source":"collector","observed_at":"2026-06-20T10:30:53.572000Z"},{"schema_version":"0.1","session_id":"90ed717574e0ef908489c4f77937461d","layer":"behavioral","kind":"power_law_exponent","value":0.20256522783648354,"source":"collector","observed_at":"2026-06-20T10:30:53.572000Z"},{"schema_version":"0.1","session_id":"90ed717574e0ef908489c4f77937461d","layer":"behavioral","kind":"submovement_count","value":7,"source":"collector","observed_at":"2026-06-20T10:30:53.572000Z"},{"schema_version":"0.1","session_id":"90ed717574e0ef908489c4f77937461d","layer":"behavioral","kind":"trace_hash","value":"f3777bba","source":"collector","observed_at":"2026-06-20T10:30:53.572000Z"}],"reputation":[]}}
