{"schema_version":"0.1","session_id":"bdba2d8ece58c8a23c0e7b341233e276","remote_ip":null,"first_seen":"2026-06-20T09:33:29Z","last_seen":"2026-06-20T09:33:33Z","request_count":22,"signals":{"network":[{"schema_version":"0.1","session_id":"bdba2d8ece58c8a23c0e7b341233e276","layer":"network","kind":"accept_language_primary","value":"en","source":"edge","observed_at":"2026-06-20T09:33:33Z"},{"schema_version":"0.1","session_id":"bdba2d8ece58c8a23c0e7b341233e276","layer":"network","kind":"h2","value":"1:65536;2:0;4:131072;5:16384|12517377|0|m,p,a,s","source":"edge","observed_at":"2026-06-20T09:33:33Z"},{"schema_version":"0.1","session_id":"bdba2d8ece58c8a23c0e7b341233e276","layer":"network","kind":"h2_browser_hint","value":"firefox","source":"edge","observed_at":"2026-06-20T09:33:33Z"},{"schema_version":"0.1","session_id":"bdba2d8ece58c8a23c0e7b341233e276","layer":"network","kind":"h2_settings_hint","value":"firefox","source":"edge","observed_at":"2026-06-20T09:33:33Z"},{"schema_version":"0.1","session_id":"bdba2d8ece58c8a23c0e7b341233e276","layer":"network","kind":"ja3","value":"57140d1fea4a64c1d846a5a4964c7f53","source":"edge","observed_at":"2026-06-20T09:33:33Z"},{"schema_version":"0.1","session_id":"bdba2d8ece58c8a23c0e7b341233e276","layer":"network","kind":"ja4","value":"t13d1717h2_5b57614c22b0_e6dcd7ae0a9e","source":"edge","observed_at":"2026-06-20T09:33:33Z"},{"schema_version":"0.1","session_id":"bdba2d8ece58c8a23c0e7b341233e276","layer":"network","kind":"ja4_browser_hint","value":"firefox","source":"edge","observed_at":"2026-06-20T09:33:33Z"},{"schema_version":"0.1","session_id":"bdba2d8ece58c8a23c0e7b341233e276","layer":"network","kind":"observed_ip","value":"172.22.0.4","source":"edge","observed_at":"2026-06-20T09:33:33Z"},{"schema_version":"0.1","session_id":"bdba2d8ece58c8a23c0e7b341233e276","layer":"network","kind":"quic_observed","value":true,"source":"edge","observed_at":"2026-06-20T09:33:33Z"},{"schema_version":"0.1","session_id":"bdba2d8ece58c8a23c0e7b341233e276","layer":"network","kind":"tcp_kernel","value":"linux","source":"edge","observed_at":"2026-06-20T09:33:33Z"},{"schema_version":"0.1","session_id":"bdba2d8ece58c8a23c0e7b341233e276","layer":"network","kind":"ua_kernel","value":"linux","source":"edge","observed_at":"2026-06-20T09:33:33Z"},{"schema_version":"0.1","session_id":"bdba2d8ece58c8a23c0e7b341233e276","layer":"network","kind":"observed_ip_seen","value":["172.22.0.4"],"source":"edge","observed_at":"2026-06-20T09:33:29Z"}],"browser":[{"schema_version":"0.1","session_id":"bdba2d8ece58c8a23c0e7b341233e276","layer":"browser","kind":"color_depth","value":24,"source":"collector","observed_at":"2026-06-20T09:33:31.400000Z"},{"schema_version":"0.1","session_id":"bdba2d8ece58c8a23c0e7b341233e276","layer":"browser","kind":"fp_hash","value":"4454c1da","source":"collector","observed_at":"2026-06-20T09:33:31.400000Z"},{"schema_version":"0.1","session_id":"bdba2d8ece58c8a23c0e7b341233e276","layer":"browser","kind":"hardware_concurrency","value":16,"source":"collector","observed_at":"2026-06-20T09:33:31.400000Z"},{"schema_version":"0.1","session_id":"bdba2d8ece58c8a23c0e7b341233e276","layer":"browser","kind":"media_devices_empty","value":true,"source":"collector","observed_at":"2026-06-20T09:33:31.400000Z"},{"schema_version":"0.1","session_id":"bdba2d8ece58c8a23c0e7b341233e276","layer":"browser","kind":"nav_language_primary","value":"en","source":"collector","observed_at":"2026-06-20T09:33:31.400000Z"},{"schema_version":"0.1","session_id":"bdba2d8ece58c8a23c0e7b341233e276","layer":"browser","kind":"nav_platform_os","value":"Linux","source":"collector","observed_at":"2026-06-20T09:33:31.400000Z"},{"schema_version":"0.1","session_id":"bdba2d8ece58c8a23c0e7b341233e276","layer":"browser","kind":"oscpu_os","value":"Linux","source":"collector","observed_at":"2026-06-20T09:33:31.400000Z"},{"schema_version":"0.1","session_id":"bdba2d8ece58c8a23c0e7b341233e276","layer":"browser","kind":"plugins_count","value":5,"source":"collector","observed_at":"2026-06-20T09:33:31.400000Z"},{"schema_version":"0.1","session_id":"bdba2d8ece58c8a23c0e7b341233e276","layer":"browser","kind":"productsub_render","value":"gecko","source":"collector","observed_at":"2026-06-20T09:33:31.400000Z"},{"schema_version":"0.1","session_id":"bdba2d8ece58c8a23c0e7b341233e276","layer":"browser","kind":"screen_resolution","value":"1485x928","source":"collector","observed_at":"2026-06-20T09:33:31.400000Z"},{"schema_version":"0.1","session_id":"bdba2d8ece58c8a23c0e7b341233e276","layer":"browser","kind":"ua_browser","value":"firefox","source":"collector","observed_at":"2026-06-20T09:33:31.400000Z"},{"schema_version":"0.1","session_id":"bdba2d8ece58c8a23c0e7b341233e276","layer":"browser","kind":"ua_engine","value":"firefox","source":"collector","observed_at":"2026-06-20T09:33:31.400000Z"},{"schema_version":"0.1","session_id":"bdba2d8ece58c8a23c0e7b341233e276","layer":"browser","kind":"ua_platform","value":"Linux","source":"collector","observed_at":"2026-06-20T09:33:31.400000Z"},{"schema_version":"0.1","session_id":"bdba2d8ece58c8a23c0e7b341233e276","layer":"browser","kind":"ua_render","value":"gecko","source":"collector","observed_at":"2026-06-20T09:33:31.400000Z"},{"schema_version":"0.1","session_id":"bdba2d8ece58c8a23c0e7b341233e276","layer":"browser","kind":"vendor_engine","value":"firefox","source":"collector","observed_at":"2026-06-20T09:33:31.400000Z"},{"schema_version":"0.1","session_id":"bdba2d8ece58c8a23c0e7b341233e276","layer":"browser","kind":"voices_empty","value":true,"source":"collector","observed_at":"2026-06-20T09:33:31.400000Z"},{"schema_version":"0.1","session_id":"bdba2d8ece58c8a23c0e7b341233e276","layer":"browser","kind":"webdriver","value":false,"source":"collector","observed_at":"2026-06-20T09:33:31.400000Z"},{"schema_version":"0.1","session_id":"bdba2d8ece58c8a23c0e7b341233e276","layer":"browser","kind":"webgl2_missing","value":true,"source":"collector","observed_at":"2026-06-20T09:33:31.400000Z"},{"schema_version":"0.1","session_id":"bdba2d8ece58c8a23c0e7b341233e276","layer":"browser","kind":"webgpu_absent","value":true,"source":"collector","observed_at":"2026-06-20T09:33:31.400000Z"},{"schema_version":"0.1","session_id":"bdba2d8ece58c8a23c0e7b341233e276","layer":"browser","kind":"webrtc_unavailable","value":true,"source":"collector","observed_at":"2026-06-20T09:33:31.400000Z"}],"behavioral":[{"schema_version":"0.1","session_id":"bdba2d8ece58c8a23c0e7b341233e276","layer":"behavioral","kind":"coalesced_events_absent","value":true,"source":"collector","observed_at":"2026-06-20T09:33:31.400000Z"},{"schema_version":"0.1","session_id":"bdba2d8ece58c8a23c0e7b341233e276","layer":"behavioral","kind":"mouse_entropy","value":0.22219278599830683,"source":"collector","observed_at":"2026-06-20T09:33:31.400000Z"},{"schema_version":"0.1","session_id":"bdba2d8ece58c8a23c0e7b341233e276","layer":"behavioral","kind":"mouse_straightness","value":0.3602190142829523,"source":"collector","observed_at":"2026-06-20T09:33:31.400000Z"},{"schema_version":"0.1","session_id":"bdba2d8ece58c8a23c0e7b341233e276","layer":"behavioral","kind":"mouse_velocity_cv","value":0.7613500657037409,"source":"collector","observed_at":"2026-06-20T09:33:31.400000Z"},{"schema_version":"0.1","session_id":"bdba2d8ece58c8a23c0e7b341233e276","layer":"behavioral","kind":"pause_ratio","value":0,"source":"collector","observed_at":"2026-06-20T09:33:31.400000Z"},{"schema_version":"0.1","session_id":"bdba2d8ece58c8a23c0e7b341233e276","layer":"behavioral","kind":"pointer_event_count","value":24,"source":"collector","observed_at":"2026-06-20T09:33:31.400000Z"},{"schema_version":"0.1","session_id":"bdba2d8ece58c8a23c0e7b341233e276","layer":"behavioral","kind":"power_law_exponent","value":0.021484375,"source":"collector","observed_at":"2026-06-20T09:33:31.400000Z"},{"schema_version":"0.1","session_id":"bdba2d8ece58c8a23c0e7b341233e276","layer":"behavioral","kind":"submovement_count","value":8,"source":"collector","observed_at":"2026-06-20T09:33:31.400000Z"},{"schema_version":"0.1","session_id":"bdba2d8ece58c8a23c0e7b341233e276","layer":"behavioral","kind":"trace_hash","value":"c374544c","source":"collector","observed_at":"2026-06-20T09:33:31.400000Z"}],"reputation":[]}}
