{"schema_version":"0.1","session_id":"34044edb00cf2857f90e113bdf9d8007","remote_ip":null,"first_seen":"2026-06-19T04:00:47Z","last_seen":"2026-06-19T04:00:49Z","request_count":20,"signals":{"network":[{"schema_version":"0.1","session_id":"34044edb00cf2857f90e113bdf9d8007","layer":"network","kind":"ch_platform_header","value":"Linux","source":"edge","observed_at":"2026-06-19T04:00:49Z"},{"schema_version":"0.1","session_id":"34044edb00cf2857f90e113bdf9d8007","layer":"network","kind":"ch_ua_browser","value":"chrome","source":"edge","observed_at":"2026-06-19T04:00:49Z"},{"schema_version":"0.1","session_id":"34044edb00cf2857f90e113bdf9d8007","layer":"network","kind":"h2","value":"1:65536;2:0;4:6291456;6:262144|15663105|0|m,a,s,p","source":"edge","observed_at":"2026-06-19T04:00:49Z"},{"schema_version":"0.1","session_id":"34044edb00cf2857f90e113bdf9d8007","layer":"network","kind":"h2_browser_hint","value":"chrome","source":"edge","observed_at":"2026-06-19T04:00:49Z"},{"schema_version":"0.1","session_id":"34044edb00cf2857f90e113bdf9d8007","layer":"network","kind":"h2_settings_hint","value":"chrome","source":"edge","observed_at":"2026-06-19T04:00:49Z"},{"schema_version":"0.1","session_id":"34044edb00cf2857f90e113bdf9d8007","layer":"network","kind":"ja3","value":"cd8cd8de86e4410f4dcfedfb6befe65f","source":"edge","observed_at":"2026-06-19T04:00:49Z"},{"schema_version":"0.1","session_id":"34044edb00cf2857f90e113bdf9d8007","layer":"network","kind":"ja4","value":"t13d1516h2_8daaf6152771_d8a2da3f94cd","source":"edge","observed_at":"2026-06-19T04:00:49Z"},{"schema_version":"0.1","session_id":"34044edb00cf2857f90e113bdf9d8007","layer":"network","kind":"observed_ip","value":"172.22.0.5","source":"edge","observed_at":"2026-06-19T04:00:49Z"},{"schema_version":"0.1","session_id":"34044edb00cf2857f90e113bdf9d8007","layer":"network","kind":"tcp_kernel","value":"linux","source":"edge","observed_at":"2026-06-19T04:00:49Z"},{"schema_version":"0.1","session_id":"34044edb00cf2857f90e113bdf9d8007","layer":"network","kind":"ua_kernel","value":"linux","source":"edge","observed_at":"2026-06-19T04:00:49Z"}],"browser":[{"schema_version":"0.1","session_id":"34044edb00cf2857f90e113bdf9d8007","layer":"browser","kind":"ch_he_headless","value":true,"source":"collector","observed_at":"2026-06-19T04:00:48.726000Z"},{"schema_version":"0.1","session_id":"34044edb00cf2857f90e113bdf9d8007","layer":"browser","kind":"ch_platform","value":"Linux","source":"collector","observed_at":"2026-06-19T04:00:48.726000Z"},{"schema_version":"0.1","session_id":"34044edb00cf2857f90e113bdf9d8007","layer":"browser","kind":"chrome_no_pdfviewer","value":true,"source":"collector","observed_at":"2026-06-19T04:00:48.726000Z"},{"schema_version":"0.1","session_id":"34044edb00cf2857f90e113bdf9d8007","layer":"browser","kind":"chrome_object_missing","value":true,"source":"collector","observed_at":"2026-06-19T04:00:48.726000Z"},{"schema_version":"0.1","session_id":"34044edb00cf2857f90e113bdf9d8007","layer":"browser","kind":"color_depth","value":24,"source":"collector","observed_at":"2026-06-19T04:00:48.726000Z"},{"schema_version":"0.1","session_id":"34044edb00cf2857f90e113bdf9d8007","layer":"browser","kind":"fp_hash","value":"adf8b397","source":"collector","observed_at":"2026-06-19T04:00:48.726000Z"},{"schema_version":"0.1","session_id":"34044edb00cf2857f90e113bdf9d8007","layer":"browser","kind":"hardware_concurrency","value":12,"source":"collector","observed_at":"2026-06-19T04:00:48.726000Z"},{"schema_version":"0.1","session_id":"34044edb00cf2857f90e113bdf9d8007","layer":"browser","kind":"math_engine_mismatch","value":true,"source":"collector","observed_at":"2026-06-19T04:00:48.726000Z"},{"schema_version":"0.1","session_id":"34044edb00cf2857f90e113bdf9d8007","layer":"browser","kind":"media_devices_empty","value":true,"source":"collector","observed_at":"2026-06-19T04:00:48.726000Z"},{"schema_version":"0.1","session_id":"34044edb00cf2857f90e113bdf9d8007","layer":"browser","kind":"mimetypes_empty","value":true,"source":"collector","observed_at":"2026-06-19T04:00:48.726000Z"},{"schema_version":"0.1","session_id":"34044edb00cf2857f90e113bdf9d8007","layer":"browser","kind":"nav_language_primary","value":"en","source":"collector","observed_at":"2026-06-19T04:00:48.726000Z"},{"schema_version":"0.1","session_id":"34044edb00cf2857f90e113bdf9d8007","layer":"browser","kind":"nav_platform_os","value":"Linux","source":"collector","observed_at":"2026-06-19T04:00:48.726000Z"},{"schema_version":"0.1","session_id":"34044edb00cf2857f90e113bdf9d8007","layer":"browser","kind":"notification_denied","value":true,"source":"collector","observed_at":"2026-06-19T04:00:48.726000Z"},{"schema_version":"0.1","session_id":"34044edb00cf2857f90e113bdf9d8007","layer":"browser","kind":"permissions_anomaly","value":true,"source":"collector","observed_at":"2026-06-19T04:00:48.726000Z"},{"schema_version":"0.1","session_id":"34044edb00cf2857f90e113bdf9d8007","layer":"browser","kind":"plugins_count","value":0,"source":"collector","observed_at":"2026-06-19T04:00:48.726000Z"},{"schema_version":"0.1","session_id":"34044edb00cf2857f90e113bdf9d8007","layer":"browser","kind":"productsub_render","value":"webkit","source":"collector","observed_at":"2026-06-19T04:00:48.726000Z"},{"schema_version":"0.1","session_id":"34044edb00cf2857f90e113bdf9d8007","layer":"browser","kind":"screen_resolution","value":"1280x720","source":"collector","observed_at":"2026-06-19T04:00:48.726000Z"},{"schema_version":"0.1","session_id":"34044edb00cf2857f90e113bdf9d8007","layer":"browser","kind":"ua_browser","value":"chrome","source":"collector","observed_at":"2026-06-19T04:00:48.726000Z"},{"schema_version":"0.1","session_id":"34044edb00cf2857f90e113bdf9d8007","layer":"browser","kind":"ua_engine","value":"chromium","source":"collector","observed_at":"2026-06-19T04:00:48.726000Z"},{"schema_version":"0.1","session_id":"34044edb00cf2857f90e113bdf9d8007","layer":"browser","kind":"ua_is_headless","value":true,"source":"collector","observed_at":"2026-06-19T04:00:48.726000Z"},{"schema_version":"0.1","session_id":"34044edb00cf2857f90e113bdf9d8007","layer":"browser","kind":"ua_platform","value":"Linux","source":"collector","observed_at":"2026-06-19T04:00:48.726000Z"},{"schema_version":"0.1","session_id":"34044edb00cf2857f90e113bdf9d8007","layer":"browser","kind":"ua_render","value":"webkit","source":"collector","observed_at":"2026-06-19T04:00:48.726000Z"},{"schema_version":"0.1","session_id":"34044edb00cf2857f90e113bdf9d8007","layer":"browser","kind":"vendor_engine","value":"chromium","source":"collector","observed_at":"2026-06-19T04:00:48.726000Z"},{"schema_version":"0.1","session_id":"34044edb00cf2857f90e113bdf9d8007","layer":"browser","kind":"voices_empty","value":true,"source":"collector","observed_at":"2026-06-19T04:00:48.726000Z"},{"schema_version":"0.1","session_id":"34044edb00cf2857f90e113bdf9d8007","layer":"browser","kind":"webdriver","value":false,"source":"collector","observed_at":"2026-06-19T04:00:48.726000Z"},{"schema_version":"0.1","session_id":"34044edb00cf2857f90e113bdf9d8007","layer":"browser","kind":"webgl_os_hint","value":"Linux","source":"collector","observed_at":"2026-06-19T04:00:48.726000Z"},{"schema_version":"0.1","session_id":"34044edb00cf2857f90e113bdf9d8007","layer":"browser","kind":"webgl_renderer","value":"ANGLE (Google, Vulkan 1.3.0 (SwiftShader Device (Subzero) (0x0000C0DE)), SwiftShader driver)","source":"collector","observed_at":"2026-06-19T04:00:48.726000Z"},{"schema_version":"0.1","session_id":"34044edb00cf2857f90e113bdf9d8007","layer":"browser","kind":"webgl_software","value":true,"source":"collector","observed_at":"2026-06-19T04:00:48.726000Z"},{"schema_version":"0.1","session_id":"34044edb00cf2857f90e113bdf9d8007","layer":"browser","kind":"webgl_vendor","value":"Google Inc. (Google)","source":"collector","observed_at":"2026-06-19T04:00:48.726000Z"},{"schema_version":"0.1","session_id":"34044edb00cf2857f90e113bdf9d8007","layer":"browser","kind":"webgpu_no_adapter","value":true,"source":"collector","observed_at":"2026-06-19T04:00:48.726000Z"}],"behavioral":[{"schema_version":"0.1","session_id":"34044edb00cf2857f90e113bdf9d8007","layer":"behavioral","kind":"keystroke_entropy","value":0.3095434291503252,"source":"collector","observed_at":"2026-06-19T04:00:48.726000Z"},{"schema_version":"0.1","session_id":"34044edb00cf2857f90e113bdf9d8007","layer":"behavioral","kind":"mouse_entropy","value":0.5618250990757782,"source":"collector","observed_at":"2026-06-19T04:00:48.726000Z"},{"schema_version":"0.1","session_id":"34044edb00cf2857f90e113bdf9d8007","layer":"behavioral","kind":"mouse_straightness","value":0.4990864492814254,"source":"collector","observed_at":"2026-06-19T04:00:48.726000Z"},{"schema_version":"0.1","session_id":"34044edb00cf2857f90e113bdf9d8007","layer":"behavioral","kind":"mouse_velocity_cv","value":1.71603632379134,"source":"collector","observed_at":"2026-06-19T04:00:48.726000Z"},{"schema_version":"0.1","session_id":"34044edb00cf2857f90e113bdf9d8007","layer":"behavioral","kind":"pointer_event_count","value":11,"source":"collector","observed_at":"2026-06-19T04:00:48.726000Z"}],"reputation":[]}}