{"schema_version":"0.1","session_id":"58016e3dfb573b1dc4249c6b0f2f31f3","remote_ip":null,"first_seen":"2026-06-20T10:15:30Z","last_seen":"2026-06-20T10:15:33.841000Z","request_count":20,"signals":{"network":[{"schema_version":"0.1","session_id":"58016e3dfb573b1dc4249c6b0f2f31f3","layer":"network","kind":"accept_language_primary","value":"en","source":"edge","observed_at":"2026-06-20T10:15:33Z"},{"schema_version":"0.1","session_id":"58016e3dfb573b1dc4249c6b0f2f31f3","layer":"network","kind":"h2","value":"1:65536;2:0;4:131072;5:16384|12517377|0|m,p,a,s","source":"edge","observed_at":"2026-06-20T10:15:33Z"},{"schema_version":"0.1","session_id":"58016e3dfb573b1dc4249c6b0f2f31f3","layer":"network","kind":"h2_browser_hint","value":"firefox","source":"edge","observed_at":"2026-06-20T10:15:33Z"},{"schema_version":"0.1","session_id":"58016e3dfb573b1dc4249c6b0f2f31f3","layer":"network","kind":"h2_settings_hint","value":"firefox","source":"edge","observed_at":"2026-06-20T10:15:33Z"},{"schema_version":"0.1","session_id":"58016e3dfb573b1dc4249c6b0f2f31f3","layer":"network","kind":"ja3","value":"d87a30a5782a73a83c1544bb06332780","source":"edge","observed_at":"2026-06-20T10:15:33Z"},{"schema_version":"0.1","session_id":"58016e3dfb573b1dc4249c6b0f2f31f3","layer":"network","kind":"ja4","value":"t13d1717h2_5b57614c22b0_3cbfd9057e0d","source":"edge","observed_at":"2026-06-20T10:15:33Z"},{"schema_version":"0.1","session_id":"58016e3dfb573b1dc4249c6b0f2f31f3","layer":"network","kind":"ja4_browser_hint","value":"firefox","source":"edge","observed_at":"2026-06-20T10:15:33Z"},{"schema_version":"0.1","session_id":"58016e3dfb573b1dc4249c6b0f2f31f3","layer":"network","kind":"observed_ip","value":"172.22.0.7","source":"edge","observed_at":"2026-06-20T10:15:33Z"},{"schema_version":"0.1","session_id":"58016e3dfb573b1dc4249c6b0f2f31f3","layer":"network","kind":"tcp_kernel","value":"linux","source":"edge","observed_at":"2026-06-20T10:15:33Z"},{"schema_version":"0.1","session_id":"58016e3dfb573b1dc4249c6b0f2f31f3","layer":"network","kind":"ua_kernel","value":"linux","source":"edge","observed_at":"2026-06-20T10:15:33Z"},{"schema_version":"0.1","session_id":"58016e3dfb573b1dc4249c6b0f2f31f3","layer":"network","kind":"observed_ip_seen","value":["172.22.0.7"],"source":"edge","observed_at":"2026-06-20T10:15:30Z"}],"browser":[{"schema_version":"0.1","session_id":"58016e3dfb573b1dc4249c6b0f2f31f3","layer":"browser","kind":"color_depth","value":24,"source":"collector","observed_at":"2026-06-20T10:15:33.841000Z"},{"schema_version":"0.1","session_id":"58016e3dfb573b1dc4249c6b0f2f31f3","layer":"browser","kind":"fp_hash","value":"b539a650","source":"collector","observed_at":"2026-06-20T10:15:33.841000Z"},{"schema_version":"0.1","session_id":"58016e3dfb573b1dc4249c6b0f2f31f3","layer":"browser","kind":"hardware_concurrency","value":16,"source":"collector","observed_at":"2026-06-20T10:15:33.841000Z"},{"schema_version":"0.1","session_id":"58016e3dfb573b1dc4249c6b0f2f31f3","layer":"browser","kind":"media_devices_empty","value":true,"source":"collector","observed_at":"2026-06-20T10:15:33.841000Z"},{"schema_version":"0.1","session_id":"58016e3dfb573b1dc4249c6b0f2f31f3","layer":"browser","kind":"nav_language_primary","value":"en","source":"collector","observed_at":"2026-06-20T10:15:33.841000Z"},{"schema_version":"0.1","session_id":"58016e3dfb573b1dc4249c6b0f2f31f3","layer":"browser","kind":"nav_platform_os","value":"Linux","source":"collector","observed_at":"2026-06-20T10:15:33.841000Z"},{"schema_version":"0.1","session_id":"58016e3dfb573b1dc4249c6b0f2f31f3","layer":"browser","kind":"oscpu_os","value":"Linux","source":"collector","observed_at":"2026-06-20T10:15:33.841000Z"},{"schema_version":"0.1","session_id":"58016e3dfb573b1dc4249c6b0f2f31f3","layer":"browser","kind":"plugins_count","value":5,"source":"collector","observed_at":"2026-06-20T10:15:33.841000Z"},{"schema_version":"0.1","session_id":"58016e3dfb573b1dc4249c6b0f2f31f3","layer":"browser","kind":"productsub_render","value":"gecko","source":"collector","observed_at":"2026-06-20T10:15:33.841000Z"},{"schema_version":"0.1","session_id":"58016e3dfb573b1dc4249c6b0f2f31f3","layer":"browser","kind":"screen_resolution","value":"1485x928","source":"collector","observed_at":"2026-06-20T10:15:33.841000Z"},{"schema_version":"0.1","session_id":"58016e3dfb573b1dc4249c6b0f2f31f3","layer":"browser","kind":"ua_browser","value":"firefox","source":"collector","observed_at":"2026-06-20T10:15:33.841000Z"},{"schema_version":"0.1","session_id":"58016e3dfb573b1dc4249c6b0f2f31f3","layer":"browser","kind":"ua_engine","value":"firefox","source":"collector","observed_at":"2026-06-20T10:15:33.841000Z"},{"schema_version":"0.1","session_id":"58016e3dfb573b1dc4249c6b0f2f31f3","layer":"browser","kind":"ua_platform","value":"Linux","source":"collector","observed_at":"2026-06-20T10:15:33.841000Z"},{"schema_version":"0.1","session_id":"58016e3dfb573b1dc4249c6b0f2f31f3","layer":"browser","kind":"ua_render","value":"gecko","source":"collector","observed_at":"2026-06-20T10:15:33.841000Z"},{"schema_version":"0.1","session_id":"58016e3dfb573b1dc4249c6b0f2f31f3","layer":"browser","kind":"vendor_engine","value":"firefox","source":"collector","observed_at":"2026-06-20T10:15:33.841000Z"},{"schema_version":"0.1","session_id":"58016e3dfb573b1dc4249c6b0f2f31f3","layer":"browser","kind":"voices_empty","value":true,"source":"collector","observed_at":"2026-06-20T10:15:33.841000Z"},{"schema_version":"0.1","session_id":"58016e3dfb573b1dc4249c6b0f2f31f3","layer":"browser","kind":"webdriver","value":false,"source":"collector","observed_at":"2026-06-20T10:15:33.841000Z"},{"schema_version":"0.1","session_id":"58016e3dfb573b1dc4249c6b0f2f31f3","layer":"browser","kind":"webgl2_missing","value":true,"source":"collector","observed_at":"2026-06-20T10:15:33.841000Z"},{"schema_version":"0.1","session_id":"58016e3dfb573b1dc4249c6b0f2f31f3","layer":"browser","kind":"webgpu_absent","value":true,"source":"collector","observed_at":"2026-06-20T10:15:33.841000Z"},{"schema_version":"0.1","session_id":"58016e3dfb573b1dc4249c6b0f2f31f3","layer":"browser","kind":"webrtc_public_ip","value":"203.0.113.7","source":"collector","observed_at":"2026-06-20T10:15:33.841000Z"}],"behavioral":[{"schema_version":"0.1","session_id":"58016e3dfb573b1dc4249c6b0f2f31f3","layer":"behavioral","kind":"coalesced_events_absent","value":true,"source":"collector","observed_at":"2026-06-20T10:15:33.841000Z"},{"schema_version":"0.1","session_id":"58016e3dfb573b1dc4249c6b0f2f31f3","layer":"behavioral","kind":"mouse_entropy","value":0.8359043045320437,"source":"collector","observed_at":"2026-06-20T10:15:33.841000Z"},{"schema_version":"0.1","session_id":"58016e3dfb573b1dc4249c6b0f2f31f3","layer":"behavioral","kind":"mouse_straightness","value":0.26015876712961133,"source":"collector","observed_at":"2026-06-20T10:15:33.841000Z"},{"schema_version":"0.1","session_id":"58016e3dfb573b1dc4249c6b0f2f31f3","layer":"behavioral","kind":"mouse_velocity_cv","value":0.6052501767409767,"source":"collector","observed_at":"2026-06-20T10:15:33.841000Z"},{"schema_version":"0.1","session_id":"58016e3dfb573b1dc4249c6b0f2f31f3","layer":"behavioral","kind":"pause_ratio","value":0,"source":"collector","observed_at":"2026-06-20T10:15:33.841000Z"},{"schema_version":"0.1","session_id":"58016e3dfb573b1dc4249c6b0f2f31f3","layer":"behavioral","kind":"pointer_event_count","value":24,"source":"collector","observed_at":"2026-06-20T10:15:33.841000Z"},{"schema_version":"0.1","session_id":"58016e3dfb573b1dc4249c6b0f2f31f3","layer":"behavioral","kind":"power_law_exponent","value":0.2888363568751147,"source":"collector","observed_at":"2026-06-20T10:15:33.841000Z"},{"schema_version":"0.1","session_id":"58016e3dfb573b1dc4249c6b0f2f31f3","layer":"behavioral","kind":"submovement_count","value":8,"source":"collector","observed_at":"2026-06-20T10:15:33.841000Z"},{"schema_version":"0.1","session_id":"58016e3dfb573b1dc4249c6b0f2f31f3","layer":"behavioral","kind":"trace_hash","value":"8eb5f602","source":"collector","observed_at":"2026-06-20T10:15:33.841000Z"}],"reputation":[]}}
